{
  "stage_id": 22,
  "name": "指紋認証",
  "assets": { "background": "bg_stage_22.png", "door": "door_white_wood.png", "bgm": "ambient_mystery_03.mp3" },
  "interactables": [
    { "id": "clue_a", "rect": [150, 180, 130, 150], "zoom_image": "print_zoom.png", "reveals": "ドアの指紋認証パネル。傍の拡大鏡で覗くと、指紋の渦が数字の形になっている：『6739』。" }
  ],
  "gimmick": { "type": "number_pad", "solutions": { "normal": "6739" }, "validate": "exact" },
  "hints": ["h_s22_1", "h_s22_2", "h_s22_3"],
  "rewards": { "memory_id": "mem_22", "text_full": "t_s22_full", "text_corrupt": "t_s22_corrupt", "item": null }
}
