{
  "stage_id": 16,
  "name": "白衣の名前",
  "assets": { "background": "bg_stage_16.png", "door": "door_white_wood.png", "bgm": "ambient_mystery_03.mp3" },
  "interactables": [
    { "id": "clue_a", "rect": [120, 150, 150, 160], "zoom_image": "coat_name_zoom.png", "reveals": "ベッドの白衣。胸の刺繍に『蓮見 鏡介 ／ 第7病棟 305号』とある。" }
  ],
  "gimmick": { "type": "number_pad", "solutions": { "normal": "7305" }, "validate": "exact" },
  "hints": ["h_s16_1", "h_s16_2", "h_s16_3"],
  "rewards": { "memory_id": "mem_16", "text_full": "t_s16_full", "text_corrupt": "t_s16_corrupt", "item": null }
}
