{
  "stage_id": 28,
  "name": "最後の数字",
  "assets": { "background": "bg_stage_28.png", "door": "door_carved.png", "bgm": "ambient_finale.mp3" },
  "interactables": [
    { "id": "switch", "rect": [300, 250, 45, 80], "toggle": true, "states": ["off", "on"] },
    { "id": "clue_a", "rect": [60, 170, 110, 110], "requires_state": [ { "interactable": "switch", "state": "on" } ], "reveals": "通電した左の盤：『千の位＝2／百の位＝0』。" },
    { "id": "clue_b", "rect": [200, 170, 110, 110], "reveals": "右の盤：『十の位＝4／一の位＝5』。" }
  ],
  "gimmick": { "type": "number_pad", "prerequisites": [ { "interactable": "switch", "state": "on" } ], "solutions": { "normal": "2045" }, "validate": "exact" },
  "hints": ["h_s28_1", "h_s28_2", "h_s28_3"],
  "rewards": { "memory_id": "mem_28", "text_full": "t_s28_full", "text_corrupt": "t_s28_corrupt", "item": null }
}
