{
  "stage_id": 12,
  "name": "ボイスレコーダー",
  "assets": {
    "background": "bg_stage_12.png",
    "door": "door_white_wood.png",
    "bgm": "ambient_mystery_03.mp3"
  },
  "interactables": [
    { "id": "recorder", "rect": [60, 180, 90, 120], "zoom_image": "recorder_zoom.png", "reveals": "ボイスレコーダー。裏面に傷で『FM 80.2』と刻まれている。再生してもノイズだけ。" },
    { "id": "radio", "rect": [200, 180, 110, 120], "zoom_image": "radio_zoom.png", "reveals": "古いラジオ。周波数を合わせれば、何か聞こえるかもしれない。" }
  ],
  "gimmick": {
    "type": "number_pad",
    "solutions": { "normal": "802" },
    "validate": "exact"
  },
  "hints": ["h_s12_1", "h_s12_2", "h_s12_3"],
  "rewards": {
    "memory_id": "mem_12",
    "text_full": "t_s12_full",
    "text_corrupt": "t_s12_corrupt",
    "item": null
  }
}
