{
  "stage_id": 5,
  "name": "消えた明かりと、選択",
  "assets": {
    "background": "bg_stage_05.png",
    "door": "door_glow.png",
    "bgm": "ambient_mystery_03.mp3"
  },
  "interactables": [
    {
      "id": "breaker",
      "rect": [300, 360, 50, 70],
      "toggle": true,
      "states": ["on", "off"]
    },
    {
      "id": "door_glow_text",
      "rect": [150, 200, 140, 120],
      "requires_state": [ { "interactable": "breaker", "state": "off" } ],
      "reveals": "暗闇に、ドアの『OPEN』が浮かぶ。外でサイレンが近づく。足元には、血に濡れた“それ”が落ちている。"
    }
  ],
  "gimmick": {
    "type": "branch",
    "prerequisites": [ { "interactable": "breaker", "state": "off" } ],
    "branches": [
      { "id": "examine", "label": "震える手で“それ”を写真に撮る", "text": "t_s05_examine", "meter": "confront", "delta": 1, "set_flag": "s05_examine" },
      { "id": "hide",    "label": "“それ”を拭き取り、隅へ隠す",   "text": "t_s05_hide",    "meter": "confront", "delta": -1, "set_flag": "s05_hide" }
    ]
  },
  "hints": ["h_s05_1", "h_s05_2", "h_s05_3"],
  "rewards": {
    "memory_id": "mem_05",
    "text_full": "t_s05_full",
    "text_corrupt": "t_s05_corrupt",
    "item": null
  }
}
