{
  "stage_id": 23,
  "name": "偽りの肖像",
  "assets": { "background": "bg_stage_23.png", "door": "door_white_wood.png", "bgm": "ambient_mystery_03.mp3" },
  "interactables": [
    { "id": "light_switch", "rect": [300, 250, 45, 80], "toggle": true, "states": ["on", "off"] },
    { "id": "clue_a", "rect": [50, 160, 90, 120], "reveals": "風景画。特に変わったところはない。" },
    {
      "id": "clue_b", "rect": [150, 160, 90, 120], "zoom_image": "fake_portrait_zoom.png",
      "reveals": "ありふれた肖像画に見える。",
      "reveals_alt": "暗がりで、この絵だけ表面に数字が浮かび上がる：『0729』。",
      "alt_when": [ { "interactable": "light_switch", "state": "off" } ]
    },
    { "id": "clue_c", "rect": [250, 160, 90, 120], "reveals": "静物画。埃をかぶっている。" }
  ],
  "gimmick": { "type": "number_pad", "solutions": { "normal": "0729" }, "validate": "exact" },
  "hints": ["h_s23_1", "h_s23_2", "h_s23_3"],
  "rewards": { "memory_id": "mem_23", "text_full": "t_s23_full", "text_corrupt": "t_s23_corrupt", "item": null }
}
