{
  "stage_id": 26,
  "name": "封蝋の紋章",
  "assets": { "background": "bg_stage_26.png", "door": "door_white_wood.png", "bgm": "ambient_mystery_03.mp3" },
  "interactables": [
    { "id": "note", "rect": [60, 150, 240, 60], "zoom_image": "seal_zoom.png", "reveals": "証拠箱の封蝋を、日付の古い順に解け：△ → ◯ → □ → ☆。" },
    { "id": "btn_triangle", "rect": [70, 290, 55, 55] },
    { "id": "btn_circle",   "rect": [135, 290, 55, 55] },
    { "id": "btn_square",   "rect": [200, 290, 55, 55] },
    { "id": "btn_star",     "rect": [265, 290, 55, 55] }
  ],
  "gimmick": { "type": "sequence_tap", "solutions": { "normal": ["btn_triangle", "btn_circle", "btn_square", "btn_star"] }, "validate": "order" },
  "hints": ["h_s26_1", "h_s26_2", "h_s26_3"],
  "rewards": { "memory_id": "mem_26", "text_full": "t_s26_full", "text_corrupt": "t_s26_corrupt", "item": null }
}
