{
  "stage_id": 25,
  "name": "矛盾を暴く",
  "assets": { "background": "bg_stage_25.png", "door": "door_carved.png", "bgm": "ambient_mystery_03.mp3" },
  "interactables": [
    { "id": "clue_a", "rect": [40, 160, 90, 120], "reveals": "日記：『主は20時、書斎で私を待っていた』。" },
    { "id": "clue_b", "rect": [140, 160, 90, 120], "reveals": "止まった時計：凶行は19時に起きたと示す。" },
    { "id": "clue_c", "rect": [240, 160, 90, 120], "reveals": "あなたの記憶：20時、あなたは玄関ホールにいた——はずだ。" }
  ],
  "gimmick": {
    "type": "branch",
    "branches": [
      { "id": "confront", "label": "矛盾を突き、真実を暴く", "text": "t_s25_confront", "meter": "confront", "delta": 1, "set_flag": "s25_confront" },
      { "id": "avert",    "label": "考えるのをやめ、目を背ける", "text": "t_s25_avert",   "meter": "confront", "delta": -1, "set_flag": "s25_avert" }
    ]
  },
  "hints": ["h_s25_1", "h_s25_2", "h_s25_3"],
  "rewards": { "memory_id": "mem_25", "text_full": "t_s25_full", "text_corrupt": "t_s25_corrupt", "item": null }
}
